{"archiveSha256":"cccccccccccccccccccccccccccccccccccccccccccccccccccccccccccccccc","configDigest":"sha256:609824f6dbe4c2f7d036c93e1a76c3a0b09c97e667a50fe80bff272cdac66b7d","createdAt":"2030-01-01T00:01:00Z","dbUpdatedAt":"2030-01-01T00:00:00Z","deploymentAuthorized":false,"imageDigest":"sha256:bbbbbbbbbbbbbbbbbbbbbbbbbbbbbbbbbbbbbbbbbbbbbbbbbbbbbbbbbbbbbbbb","imagePolicyPassed":true,"imageRepository":"ghcr.io/syuhei0519/backend-app-order","imageScanSha256":"63b684854bd4961bcb515b09823ea700dda69135486c5e11352bb1d7850f534e","isolatedRuntimePassed":true,"protectedMain":true,"published":true,"repository":"syuhei0519/backend-app","runAttempt":2,"runId":123,"sbomSha256":"b9104ba1eba76b6b080694eb4eb1717e38d5d9b7dbe4469e50acbfd756c5ca56","sbomValidated":true,"scannedAt":"2030-01-01T00:00:00Z","schema":"core-platform/github-release/v2","service":"order","sourceCommit":"aaaaaaaaaaaaaaaaaaaaaaaaaaaaaaaaaaaaaaaa","sourcePolicyPassed":true,"sourceScanSha256":"dddddddddddddddddddddddddddddddddddddddddddddddddddddddddddddddd","validUntil":"2030-01-02T00:00:00Z","workflowRef":"syuhei0519/backend-app/.github/workflows/ci.yml@refs/heads/main"}
